{"calendar_version":1,"content_hash":"ea6cef098ab8176c76e537ca7f26f69314853775c280df98800831cc4b1a51dd","created_at":"2026-10-07T22:03:52Z","environment_namespace":"production","evidence_class":"FORWARD_OPERATIONAL","id":"01a11864-f81e-7e4b-9a5b-e802eeb5e02c","owning_authority":"calendar","schema_name":"qc2.time_operation.CalendarManifest.v1","schema_version":"1.0","sessions":["2026-10-07"],"source_refs":[{"content_hash":"d17915f89a8c5e9eb760ad6514192d8816792b265a16e7cc7085e8438eaa4293","target_id":"01a11864-f817-77c0-9435-6923e03d5f52","target_schema_name":"qc2.integrity_build.EvidenceEvent.v1"}],"timezone":"America/New_York","valid_from":"2026-10-07","valid_through":"2026-10-07"}